{
  "$schema": "https://wachuma.org/schemas/growing-guide.schema.json",
  "schemaVersion": "1.0",
  "publicId": "guide-echinopsis-pachanoi-general-cacti-v1",
  "guideKey": "echinopsis-pachanoi-general-cacti",
  "version": 1,
  "title": "Orientación de cultivo · Echinopsis pachanoi · cactáceas en contenedor",
  "biologicalEntityPublicId": "biological-entity-echinopsis-pachanoi",
  "climateContext": "Condiciones de cultivo en contenedor; ajustar a clima local",
  "techniqueContext": "Guía institucional general para cactáceas y suculentas",
  "regionContext": "Orientación horticultural RHS; no sustituye un protocolo regional",
  "status": "published",
  "summary": "Guía publicada con alcance explícito: las afirmaciones provienen de una guía general de RHS para cactáceas y suculentas, no de un ensayo específico de Echinopsis pachanoi.",
  "coverage": {
    "sections": [
      { "sectionKey": "propagation", "status": "documented" },
      { "sectionKey": "substrate", "status": "documented" },
      { "sectionKey": "watering", "status": "documented" },
      { "sectionKey": "light", "status": "documented" },
      { "sectionKey": "temperature", "status": "documented" },
      { "sectionKey": "humidity", "status": "documented" },
      { "sectionKey": "nutrition", "status": "documented" },
      { "sectionKey": "calendar", "status": "documented" },
      { "sectionKey": "pests", "status": "documented" },
      { "sectionKey": "diseases", "status": "documented" },
      { "sectionKey": "transplant", "status": "documented" },
      { "sectionKey": "fruiting", "status": "documented" },
      {
        "sectionKey": "harvest",
        "status": "not_applicable",
        "note": "La guía RHS es ornamental y no ofrece un protocolo de cosecha; WACHUMA no infiere uno."
      },
      {
        "sectionKey": "observations",
        "status": "not_applicable",
        "note": "La guía resume orientación bibliográfica; las observaciones fechadas pertenecen al ledger del jardín."
      },
      { "sectionKey": "bibliography", "status": "documented" }
    ]
  },
  "claims": [
    {
      "sectionKey": "substrate",
      "statement": "Para cactáceas y suculentas en contenedor, RHS recomienda un medio muy drenante y con material granular que evite el encharcamiento. Es una orientación general, no una mezcla validada específicamente para Echinopsis pachanoi.",
      "evidenceLevel": "documented",
      "sourcePublicId": "source-rhs-cacti-succulents-guide",
      "assertionType": "horticultural_guidance"
    },
    {
      "sectionKey": "watering",
      "statement": "RHS recomienda regar de forma abundante cuando la superficie del sustrato está seca durante el periodo de crecimiento y dejar escurrir el exceso; el calendario depende del clima y del contenedor.",
      "evidenceLevel": "documented",
      "sourcePublicId": "source-rhs-cacti-succulents-guide",
      "assertionType": "horticultural_guidance"
    },
    {
      "sectionKey": "propagation",
      "statement": "RHS indica que los cactus columnares pueden propagarse por esquejes de tallo; deja el extremo cortado secar y formar callo, y coloca el esqueje en una mezcla ligeramente húmeda para reducir el riesgo de pudrición. La guía no describe injertos y WACHUMA no infiere un método de injerto.",
      "evidenceLevel": "documented",
      "sourcePublicId": "source-rhs-cacti-succulents-guide",
      "assertionType": "horticultural_guidance"
    },
    {
      "sectionKey": "temperature",
      "statement": "Para cactáceas de interior en el contexto británico, RHS describe un reposo otoñal/invernal con condiciones más frescas y riego mínimo o nulo; no debe extrapolarse sin revisar el clima local.",
      "evidenceLevel": "documented",
      "sourcePublicId": "source-rhs-cacti-succulents-guide",
      "assertionType": "horticultural_guidance"
    },
    {
      "sectionKey": "light",
      "statement": "RHS indica que la mayoría de los cactus y suculentas de interior prefieren luz brillante y que muchos toleran un alféizar soleado; también advierte que la luz insuficiente produce plantas débiles y deformadas. No lo presenta como umbral específico de Echinopsis pachanoi.",
      "evidenceLevel": "documented",
      "sourcePublicId": "source-rhs-cacti-succulents-guide",
      "assertionType": "horticultural_guidance"
    },
    {
      "sectionKey": "humidity",
      "statement": "RHS señala que los cactus y suculentas generalmente prefieren baja humedad atmosférica y buena ventilación, con excepciones para especies epífitas tropicales; no establece un porcentaje aplicable a Echinopsis pachanoi.",
      "evidenceLevel": "documented",
      "sourcePublicId": "source-rhs-cacti-succulents-guide",
      "assertionType": "horticultural_guidance"
    },
    {
      "sectionKey": "nutrition",
      "statement": "RHS recomienda alimentar una vez al mes durante la temporada de crecimiento (abril–septiembre en su contexto) con fertilizante líquido rico en potasio o uno específico para cactus; el calendario debe ajustarse al clima local.",
      "evidenceLevel": "documented",
      "sourcePublicId": "source-rhs-cacti-succulents-guide",
      "assertionType": "horticultural_guidance"
    },
    {
      "sectionKey": "calendar",
      "statement": "RHS sitúa el reposo de la mayoría de los cactus de interior entre noviembre y comienzos de marzo, con condiciones más frescas y riego mínimo o nulo; lo presenta como calendario británico y no como estación universal para los Andes.",
      "evidenceLevel": "documented",
      "sourcePublicId": "source-rhs-cacti-succulents-guide",
      "assertionType": "horticultural_guidance"
    },
    {
      "sectionKey": "pests",
      "statement": "Entre los problemas de cactáceas y suculentas, RHS enumera insectos chupadores como cochinillas, ácaros rojos y cochinillas escama; la lista no demuestra presencia ni prevalencia en Echinopsis pachanoi.",
      "evidenceLevel": "documented",
      "sourcePublicId": "source-rhs-cacti-succulents-guide",
      "assertionType": "horticultural_guidance"
    },
    {
      "sectionKey": "diseases",
      "statement": "RHS relaciona el exceso de riego con daño radicular y pudrición, y describe edema, daños por frío y costra corchosa asociados a condiciones inadecuadas; no ofrece un diagnóstico fitopatológico específico para Echinopsis pachanoi.",
      "evidenceLevel": "documented",
      "sourcePublicId": "source-rhs-cacti-succulents-guide",
      "assertionType": "horticultural_guidance"
    },
    {
      "sectionKey": "transplant",
      "statement": "RHS recomienda trasplantar en primavera cuando las raíces llenan el recipiente o la planta lo supera, y evitar macetas demasiado grandes porque el volumen sobrante puede permanecer húmedo y favorecer la pudrición.",
      "evidenceLevel": "documented",
      "sourcePublicId": "source-rhs-cacti-succulents-guide",
      "assertionType": "horticultural_guidance"
    },
    {
      "sectionKey": "fruiting",
      "statement": "RHS indica que muchos cactus producen flores y que un periodo fresco y seco de reposo, junto con mucha luz, puede estimular la floración; no atribuye ese resultado específicamente a Echinopsis pachanoi.",
      "evidenceLevel": "documented",
      "sourcePublicId": "source-rhs-cacti-succulents-guide",
      "assertionType": "horticultural_guidance"
    }
  ]
}
