{
  "$schema": "https://wachuma.org/schemas/growing-guide.schema.json",
  "schemaVersion": "1.0",
  "publicId": "guide-pleurotus-ostreatus-debonis-2026-v1",
  "guideKey": "pleurotus-ostreatus-debonis-2026",
  "version": 1,
  "title": "Guía experimental de cultivo · Pleurotus ostreatus · De Bonis et al. 2026",
  "biologicalEntityPublicId": "biological-entity-pleurotus-ostreatus",
  "climateContext": "Sala de cultivo controlada; 23 °C durante incubación y 18 °C durante los dos primeros flushes del ensayo",
  "techniqueContext": "Bolsas de sustrato esterilizado, spawn de grano y tratamientos de luz LED; protocolo experimental, no receta universal",
  "regionContext": "Penn State, State College, Estados Unidos; adaptar cualquier aplicación a la cepa, infraestructura y clima local",
  "status": "published",
  "summary": "Guía versionada y acotada a un ensayo abierto que comparó sustratos y longitudes de onda en Pleurotus ostreatus. Cada afirmación conserva el contexto experimental y no se presenta como una regla taxonómica general.",
  "coverage": {
    "sections": [
      { "sectionKey": "propagation", "status": "documented" },
      { "sectionKey": "substrate", "status": "documented" },
      { "sectionKey": "watering", "status": "not_documented" },
      { "sectionKey": "light", "status": "documented" },
      { "sectionKey": "temperature", "status": "documented" },
      { "sectionKey": "humidity", "status": "not_documented" },
      { "sectionKey": "nutrition", "status": "not_documented" },
      { "sectionKey": "calendar", "status": "not_documented" },
      { "sectionKey": "pests", "status": "not_documented" },
      { "sectionKey": "diseases", "status": "not_documented" },
      {
        "sectionKey": "transplant",
        "status": "not_applicable",
        "note": "El ensayo publicado no estudia trasplante."
      },
      { "sectionKey": "fruiting", "status": "not_documented" },
      { "sectionKey": "harvest", "status": "documented" },
      { "sectionKey": "observations", "status": "documented" },
      { "sectionKey": "bibliography", "status": "documented" }
    ]
  },
  "claims": [
    {
      "sectionKey": "substrate",
      "statement": "El ensayo comparó paja de trigo y una mezcla de 75% de cascarilla de algodón con 25% de paja de trigo; preparó los sustratos con un rango de humedad de 65–70%. Estas formulaciones describen el ensayo y no una receta universal.",
      "evidenceLevel": "documented",
      "sourcePublicId": "source-debonis-pleurotus-light-substrate-2026",
      "assertionType": "horticultural_guidance"
    },
    {
      "sectionKey": "propagation",
      "statement": "En el protocolo experimental, las bolsas se esterilizaron durante 20 minutos a 121 °C, se dejaron enfriar y se inocularon con spawn de Pleurotus ostreatus al 3% del peso del sustrato.",
      "evidenceLevel": "documented",
      "sourcePublicId": "source-debonis-pleurotus-light-substrate-2026",
      "assertionType": "horticultural_guidance"
    },
    {
      "sectionKey": "temperature",
      "statement": "La sala del ensayo se mantuvo a 23 °C durante la incubación y se redujo a 18 °C durante el primer y segundo flush; son condiciones del experimento de De Bonis et al., no un rango universal para todas las cepas.",
      "evidenceLevel": "documented",
      "sourcePublicId": "source-debonis-pleurotus-light-substrate-2026",
      "assertionType": "horticultural_guidance"
    },
    {
      "sectionKey": "light",
      "statement": "El estudio aplicó tratamientos LED durante 8 horas diarias, con una intensidad de 26–28 μmol m⁻² s⁻¹, comparando luz roja, azul, blanca, combinada y oscuridad; sus resultados no establecen todavía un protocolo lumínico universal.",
      "evidenceLevel": "documented",
      "sourcePublicId": "source-debonis-pleurotus-light-substrate-2026",
      "assertionType": "horticultural_guidance"
    },
    {
      "sectionKey": "harvest",
      "statement": "Los cuerpos fructíferos se cosecharon en madurez comercial, cuando los bordes del sombrero comenzaban a quedar paralelos al suelo y antes de curvarse hacia arriba; el ensayo siguió dos flushes.",
      "evidenceLevel": "documented",
      "sourcePublicId": "source-debonis-pleurotus-light-substrate-2026",
      "assertionType": "horticultural_guidance"
    },
    {
      "sectionKey": "observations",
      "statement": "El rendimiento y la morfología respondieron conjuntamente al sustrato y a la luz, por lo que la guía debe leerse como un protocolo reproducible y situado, no como una instrucción única para cualquier cepa o región.",
      "evidenceLevel": "documented",
      "sourcePublicId": "source-debonis-pleurotus-light-substrate-2026",
      "assertionType": "horticultural_guidance"
    }
  ]
}
